{
  "$schema": "../../../runtime/quiz/quiz.v1.schema.json",
  "languages": ["de", "en"],
  "title": {
    "de": "Formen und Schichten",
    "en": "Shapes and layers"
  },
  "intro": {
    "de": "Vier Fragen, bei denen etwas zu sehen oder zu lesen ist.",
    "en": "Four questions with something to look at or to read."
  },
  "questions": [
    {
      "id": "ring",
      "type": "single-choice",
      "text": {
        "de": "Welche Form zeigt das Bild?",
        "en": "Which shape does the picture show?"
      },
      "material": [
        {
          "type": "figure",
          "image": "images/kreis.svg",
          "alt": {
            "de": "Ein blauer Kreis mit einem weißen Kreis in der Mitte",
            "en": "A blue circle with a white circle in the middle"
          },
          "caption": {
            "de": "Zwei Kreise mit demselben Mittelpunkt.",
            "en": "Two circles with the same centre."
          },
          "source": {
            "de": "eigene Zeichnung",
            "en": "own drawing"
          },
          "licence": "CC0-1.0"
        }
      ],
      "options": [
        {
          "text": {
            "de": "Ein Ring",
            "en": "A ring"
          },
          "correct": true,
          "info": {
            "de": "Ein Ring liegt zwischen zwei Kreisen mit demselben Mittelpunkt.",
            "en": "A ring lies between two circles with the same centre."
          }
        },
        {
          "text": {
            "de": "Eine Ellipse",
            "en": "An ellipse"
          },
          "correct": false,
          "info": {
            "de": "Eine Ellipse hat zwei Brennpunkte statt eines Mittelpunkts für beide Ränder.",
            "en": "An ellipse has two foci rather than one centre for both edges."
          }
        },
        {
          "text": {
            "de": "Ein Quadrat",
            "en": "A square"
          },
          "correct": false,
          "info": {
            "de": "Ein Quadrat hat vier gleich lange gerade Seiten.",
            "en": "A square has four straight sides of equal length."
          }
        }
      ],
      "explanation": {
        "de": "Die weiße Fläche in der Mitte macht aus der Kreisscheibe einen Ring.",
        "en": "The white area in the middle makes the disc a ring."
      },
      "links": [
        {
          "title": {
            "de": "Kreisring (Wikipedia)",
            "en": "Annulus (Wikipedia)"
          },
          "url": {
            "de": "https://de.wikipedia.org/wiki/Kreisring",
            "en": "https://en.wikipedia.org/wiki/Annulus_(mathematics)"
          }
        }
      ]
    },
    {
      "id": "flaeche",
      "type": "number",
      "text": {
        "de": "Wie groß ist die Fläche des Rechtecks in Quadratmetern?",
        "en": "How large is the area of the rectangle in square metres?"
      },
      "material": [
        {
          "type": "table",
          "caption": {
            "de": "Maße des Rechtecks",
            "en": "Measurements of the rectangle"
          },
          "header": [
            {
              "de": "Seite",
              "en": "Side"
            },
            {
              "de": "Länge",
              "en": "Length"
            }
          ],
          "rowHeaders": true,
          "rows": [
            [
              {
                "de": "a",
                "en": "a"
              },
              {
                "de": "4 m",
                "en": "4 m"
              }
            ],
            [
              {
                "de": "b",
                "en": "b"
              },
              {
                "de": "2,5 m",
                "en": "2.5 m"
              }
            ]
          ]
        },
        {
          "type": "formula",
          "formula": "A = a \\cdot b"
        }
      ],
      "answer": 10,
      "tolerance": 0,
      "unit": {
        "de": "m²",
        "en": "m²"
      },
      "explanation": {
        "de": "A = 4 m · 2,5 m = 10 m².",
        "en": "A = 4 m · 2.5 m = 10 m²."
      },
      "links": [
        {
          "title": {
            "de": "Rechteck (Wikipedia)",
            "en": "Rectangle (Wikipedia)"
          },
          "url": {
            "de": "https://de.wikipedia.org/wiki/Rechteck",
            "en": "https://en.wikipedia.org/wiki/Rectangle"
          }
        }
      ]
    },
    {
      "id": "schichten",
      "type": "true-false",
      "text": {
        "de": "Die Schicht 2 liegt zwischen den Schichten 1 und 3.",
        "en": "Layer 2 lies between layers 1 and 3."
      },
      "material": [
        {
          "type": "text",
          "text": {
            "de": "Das Bild zeigt drei **Schichten** von unten nach oben.",
            "en": "The picture shows three **layers** from bottom to top."
          }
        },
        {
          "type": "labelled-figure",
          "image": "images/schnitt.svg",
          "alt": {
            "de": "Drei übereinander liegende Schichten: grau, grün, blau",
            "en": "Three layers on top of each other: grey, green, blue"
          },
          "caption": {
            "de": "Die Schichten sind nummeriert.",
            "en": "The layers are numbered."
          },
          "labels": [
            {
              "x": 50,
              "y": 80,
              "text": {
                "de": "Untere Schicht",
                "en": "Lower layer"
              }
            },
            {
              "x": 50,
              "y": 58,
              "text": {
                "de": "Mittlere Schicht",
                "en": "Middle layer"
              }
            },
            {
              "x": 50,
              "y": 30,
              "text": {
                "de": "Obere Schicht",
                "en": "Upper layer"
              }
            }
          ],
          "source": {
            "de": "eigene Zeichnung",
            "en": "own drawing"
          },
          "licence": "CC0-1.0"
        }
      ],
      "answer": true,
      "explanation": {
        "de": "Die Nummern gehen von unten nach oben; Schicht 2 ist die mittlere.",
        "en": "The numbers go from bottom to top; layer 2 is the middle one."
      },
      "links": [
        {
          "title": {
            "de": "Schichtung (Wikipedia)",
            "en": "Stratification (Wikipedia)"
          },
          "url": {
            "de": "https://de.wikipedia.org/wiki/Schichtung",
            "en": "https://en.wikipedia.org/wiki/Stratification_(geology)"
          }
        }
      ]
    },
    {
      "id": "zitat",
      "type": "single-choice",
      "text": {
        "de": "Was gibt dieser Code aus?",
        "en": "What does this code print?"
      },
      "material": [
        {
          "type": "quote",
          "text": {
            "de": "Ein Programm ist nur so gut wie seine Fragen.",
            "en": "A program is only as good as its questions."
          },
          "origin": {
            "author": "Anonym",
            "work": {
              "de": "Erfundenes Beispiel",
              "en": "Made-up example"
            },
            "year": 2026
          },
          "source": {
            "de": "eigener Text",
            "en": "own text"
          },
          "licence": "CC0-1.0"
        },
        {
          "type": "code",
          "language": "python",
          "code": "print(2 + 3)",
          "caption": {
            "de": "Ein Python-Programm",
            "en": "A Python program"
          }
        }
      ],
      "options": [
        {
          "text": {
            "de": "5",
            "en": "5"
          },
          "correct": true,
          "info": {
            "de": "2 + 3 ergibt 5.",
            "en": "2 + 3 is 5."
          }
        },
        {
          "text": {
            "de": "23",
            "en": "23"
          },
          "correct": false,
          "info": {
            "de": "Zahlen werden addiert, nicht aneinandergehängt.",
            "en": "Numbers are added, not joined."
          }
        }
      ],
      "explanation": {
        "de": "print gibt das Ergebnis der Rechnung aus.",
        "en": "print outputs the result of the calculation."
      },
      "links": [
        {
          "title": {
            "de": "Python (Wikipedia)",
            "en": "Python (Wikipedia)"
          },
          "url": {
            "de": "https://de.wikipedia.org/wiki/Python_(Programmiersprache)",
            "en": "https://en.wikipedia.org/wiki/Python_(programming_language)"
          }
        }
      ]
    }
  ]
}
